{
  "schemaVersion": 1,
  "contractId": "LOL-V2-PROTOCOL-MESSAGE-REGISTRY",
  "status": "Accepted",
  "version": "1.2.0",
  "messages": [
    {
      "semanticName": "AuthenticateGameSession",
      "messageId": 1,
      "direction": "CLIENT_TO_SERVER",
      "canonicalChannel": "TCP",
      "deliveryClass": "TCP_CONTROL",
      "ownerModule": "session",
      "lifecycleScope": "SESSION",
      "requiresRequestId": true,
      "requiresCommandId": false,
      "requiresEventId": false,
      "schemaVersion": 1,
      "releaseSince": "v1.0.0-alpha.1"
    },
    {
      "semanticName": "Welcome",
      "messageId": 2,
      "direction": "SERVER_TO_CLIENT",
      "canonicalChannel": "TCP",
      "deliveryClass": "TCP_CONTROL",
      "ownerModule": "session",
      "lifecycleScope": "SESSION",
      "requiresRequestId": true,
      "requiresCommandId": false,
      "requiresEventId": false,
      "schemaVersion": 1,
      "releaseSince": "v1.0.0-alpha.1"
    },
    {
      "semanticName": "AuthenticationRejected",
      "messageId": 3,
      "direction": "SERVER_TO_CLIENT",
      "canonicalChannel": "TCP",
      "deliveryClass": "TCP_CONTROL",
      "ownerModule": "session",
      "lifecycleScope": "SESSION",
      "requiresRequestId": true,
      "requiresCommandId": false,
      "requiresEventId": false,
      "schemaVersion": 1,
      "releaseSince": "v1.0.0-alpha.1"
    },
    {
      "semanticName": "SessionReplaced",
      "messageId": 4,
      "direction": "SERVER_TO_CLIENT",
      "canonicalChannel": "TCP",
      "deliveryClass": "TCP_CONTROL",
      "ownerModule": "session",
      "lifecycleScope": "SESSION",
      "requiresRequestId": false,
      "requiresCommandId": false,
      "requiresEventId": false,
      "schemaVersion": 1,
      "releaseSince": "v1.0.0-alpha.1"
    },
    {
      "semanticName": "LobbyEntrySnapshot",
      "messageId": 5,
      "direction": "SERVER_TO_CLIENT",
      "canonicalChannel": "TCP",
      "deliveryClass": "TCP_CONTROL",
      "ownerModule": "lobby-room",
      "lifecycleScope": "LOBBY",
      "requiresRequestId": false,
      "requiresCommandId": false,
      "requiresEventId": false,
      "schemaVersion": 1,
      "releaseSince": "v1.0.0-alpha.2"
    },
    {
      "semanticName": "LobbyRoomListUpdate",
      "messageId": 6,
      "direction": "SERVER_TO_CLIENT",
      "canonicalChannel": "TCP",
      "deliveryClass": "TCP_CONTROL",
      "ownerModule": "lobby-room",
      "lifecycleScope": "LOBBY",
      "requiresRequestId": false,
      "requiresCommandId": false,
      "requiresEventId": false,
      "schemaVersion": 1,
      "releaseSince": "v1.0.0-alpha.2"
    },
    {
      "semanticName": "CreateRoom",
      "messageId": 7,
      "direction": "CLIENT_TO_SERVER",
      "canonicalChannel": "TCP",
      "deliveryClass": "TCP_CONTROL",
      "ownerModule": "lobby-room",
      "lifecycleScope": "ROOM",
      "requiresRequestId": true,
      "requiresCommandId": false,
      "requiresEventId": false,
      "schemaVersion": 1,
      "releaseSince": "v1.0.0-alpha.2"
    },
    {
      "semanticName": "JoinRoom",
      "messageId": 8,
      "direction": "CLIENT_TO_SERVER",
      "canonicalChannel": "TCP",
      "deliveryClass": "TCP_CONTROL",
      "ownerModule": "lobby-room",
      "lifecycleScope": "ROOM",
      "requiresRequestId": true,
      "requiresCommandId": false,
      "requiresEventId": false,
      "schemaVersion": 1,
      "releaseSince": "v1.0.0-alpha.2"
    },
    {
      "semanticName": "LeaveRoom",
      "messageId": 9,
      "direction": "CLIENT_TO_SERVER",
      "canonicalChannel": "TCP",
      "deliveryClass": "TCP_CONTROL",
      "ownerModule": "lobby-room",
      "lifecycleScope": "ROOM",
      "requiresRequestId": true,
      "requiresCommandId": false,
      "requiresEventId": false,
      "schemaVersion": 1,
      "releaseSince": "v1.0.0-alpha.2"
    },
    {
      "semanticName": "SetReady",
      "messageId": 10,
      "direction": "CLIENT_TO_SERVER",
      "canonicalChannel": "TCP",
      "deliveryClass": "TCP_CONTROL",
      "ownerModule": "lobby-room",
      "lifecycleScope": "ROOM",
      "requiresRequestId": true,
      "requiresCommandId": false,
      "requiresEventId": false,
      "schemaVersion": 1,
      "releaseSince": "v1.0.0-alpha.2"
    },
    {
      "semanticName": "KickRoomMember",
      "messageId": 11,
      "direction": "CLIENT_TO_SERVER",
      "canonicalChannel": "TCP",
      "deliveryClass": "TCP_CONTROL",
      "ownerModule": "lobby-room",
      "lifecycleScope": "ROOM",
      "requiresRequestId": true,
      "requiresCommandId": false,
      "requiresEventId": false,
      "schemaVersion": 1,
      "releaseSince": "v1.0.0-alpha.2"
    },
    {
      "semanticName": "RoomCommandResponse",
      "messageId": 12,
      "direction": "SERVER_TO_CLIENT",
      "canonicalChannel": "TCP",
      "deliveryClass": "TCP_CONTROL",
      "ownerModule": "lobby-room",
      "lifecycleScope": "ROOM",
      "requiresRequestId": true,
      "requiresCommandId": false,
      "requiresEventId": false,
      "schemaVersion": 1,
      "releaseSince": "v1.0.0-alpha.2"
    },
    {
      "semanticName": "RoomDetailProjection",
      "messageId": 13,
      "direction": "SERVER_TO_CLIENT",
      "canonicalChannel": "TCP",
      "deliveryClass": "TCP_CONTROL",
      "ownerModule": "lobby-room",
      "lifecycleScope": "ROOM",
      "requiresRequestId": false,
      "requiresCommandId": false,
      "requiresEventId": false,
      "schemaVersion": 1,
      "releaseSince": "v1.0.0-alpha.2"
    },
    {
      "semanticName": "HostStartRequest",
      "messageId": 14,
      "direction": "CLIENT_TO_SERVER",
      "canonicalChannel": "TCP",
      "deliveryClass": "TCP_CONTROL",
      "ownerModule": "lobby-room",
      "lifecycleScope": "ROOM",
      "requiresRequestId": true,
      "requiresCommandId": false,
      "requiresEventId": false,
      "schemaVersion": 1,
      "releaseSince": "v1.0.0-alpha.3"
    },
    {
      "semanticName": "BattleCommandResponse",
      "messageId": 15,
      "direction": "SERVER_TO_CLIENT",
      "canonicalChannel": "TCP",
      "deliveryClass": "TCP_CONTROL",
      "ownerModule": "battle",
      "lifecycleScope": "BATTLE",
      "requiresRequestId": true,
      "requiresCommandId": false,
      "requiresEventId": false,
      "schemaVersion": 1,
      "releaseSince": "v1.0.0-alpha.3"
    },
    {
      "semanticName": "ArenaLoadEntry",
      "messageId": 16,
      "direction": "SERVER_TO_CLIENT",
      "canonicalChannel": "TCP",
      "deliveryClass": "TCP_CONTROL",
      "ownerModule": "battle",
      "lifecycleScope": "BATTLE",
      "requiresRequestId": false,
      "requiresCommandId": false,
      "requiresEventId": false,
      "schemaVersion": 1,
      "releaseSince": "v1.0.0-alpha.3"
    },
    {
      "semanticName": "ArenaLoadComplete",
      "messageId": 17,
      "direction": "CLIENT_TO_SERVER",
      "canonicalChannel": "TCP",
      "deliveryClass": "TCP_CONTROL",
      "ownerModule": "battle",
      "lifecycleScope": "BATTLE",
      "requiresRequestId": true,
      "requiresCommandId": false,
      "requiresEventId": false,
      "schemaVersion": 1,
      "releaseSince": "v1.0.0-alpha.3"
    },
    {
      "semanticName": "ArenaGameplayStart",
      "messageId": 18,
      "direction": "SERVER_TO_CLIENT",
      "canonicalChannel": "TCP",
      "deliveryClass": "TCP_CONTROL",
      "ownerModule": "battle",
      "lifecycleScope": "BATTLE",
      "requiresRequestId": false,
      "requiresCommandId": false,
      "requiresEventId": false,
      "schemaVersion": 1,
      "releaseSince": "v1.0.0-alpha.3"
    },
    {
      "semanticName": "ArenaLoadCancelled",
      "messageId": 19,
      "direction": "SERVER_TO_CLIENT",
      "canonicalChannel": "TCP",
      "deliveryClass": "TCP_CONTROL",
      "ownerModule": "battle",
      "lifecycleScope": "BATTLE",
      "requiresRequestId": false,
      "requiresCommandId": false,
      "requiresEventId": false,
      "schemaVersion": 1,
      "releaseSince": "v1.0.0-alpha.3"
    },
    {
      "semanticName": "RequestRudpBindCapability",
      "messageId": 20,
      "direction": "CLIENT_TO_SERVER",
      "canonicalChannel": "TCP",
      "deliveryClass": "TCP_CONTROL",
      "ownerModule": "session",
      "lifecycleScope": "SESSION",
      "requiresRequestId": true,
      "requiresCommandId": false,
      "requiresEventId": false,
      "schemaVersion": 1,
      "releaseSince": "v1.0.0-alpha.4"
    },
    {
      "semanticName": "RudpBindCapability",
      "messageId": 21,
      "direction": "SERVER_TO_CLIENT",
      "canonicalChannel": "TCP",
      "deliveryClass": "TCP_CONTROL",
      "ownerModule": "session",
      "lifecycleScope": "SESSION",
      "requiresRequestId": true,
      "requiresCommandId": false,
      "requiresEventId": false,
      "schemaVersion": 1,
      "releaseSince": "v1.0.0-alpha.4"
    },
    {
      "semanticName": "RudpBindHello",
      "messageId": 22,
      "direction": "CLIENT_TO_SERVER",
      "canonicalChannel": "RUDP_RELIABLE",
      "deliveryClass": "TRANSPORT_CONTROL",
      "ownerModule": "transport-rudp",
      "lifecycleScope": "TRANSPORT",
      "requiresRequestId": false,
      "requiresCommandId": false,
      "requiresEventId": false,
      "schemaVersion": 1,
      "releaseSince": "v1.0.0-alpha.4"
    },
    {
      "semanticName": "RudpBindAccepted",
      "messageId": 23,
      "direction": "SERVER_TO_CLIENT",
      "canonicalChannel": "RUDP_RELIABLE",
      "deliveryClass": "TRANSPORT_CONTROL",
      "ownerModule": "transport-rudp",
      "lifecycleScope": "TRANSPORT",
      "requiresRequestId": false,
      "requiresCommandId": false,
      "requiresEventId": false,
      "schemaVersion": 1,
      "releaseSince": "v1.0.0-alpha.4"
    },
    {
      "semanticName": "RudpHeartbeat",
      "messageId": 24,
      "direction": "CLIENT_TO_SERVER",
      "canonicalChannel": "RUDP_UNRELIABLE",